,Candidate,Response,Score,Magnitude
0,Atiku,He is forward thinking,0.300000012,0.300000012
1,Buhari,He is forward thinking,0.300000012,0.300000012
2,Atiku ,We need change and he can bring it,0.300000012,0.300000012
3,Jega,I think he would be a good option,0.5,0.5
4,Femi ,The people have never seen anybody else more ready for the job,0.400000006,0.400000006
5,Femi ,He is not a silly person,-0.400000006,0.400000006
6,Femi ,really good and authentic Thai food! in particular we loved their tom yup clear soup with sliced fish. it's so well balanced that we can have it just on its own. ,0.899999976,2.700000048
